"5","Скажіть будь ласка. Наприклад якщо я візьму його с собою по гриби, після того я зможу його підключити до ПК і вивести пройдений мною маршрут на Google Maps. Також цыкавить чи можу я під час збирання грибів, відмічати на карті точки, а потім так само підключивши до ПК побачити іх на карті? Заздалегідь дякую."
"5","Чудесно планирует и прокладывает маршрут а также меряет размеры поля."
"3","в комплекті не йдуть батерейки...."
"5","Скажіть будь ласка. Наприклад якщо я візьму його с собою по гриби, після того я зможу його підключити до ПК і вивести пройдений мною маршрут на Google Maps. Також цыкавить чи можу я під час збирання грибів, відмічати на карті точки, а потім так само підключивши до ПК побачити іх на карті? Заздалегідь дякую."
"5","Чудесно планирует и прокладывает маршрут а также меряет размеры поля."
"3","в комплекті не йдуть батерейки...."
"5","нормуль"
"5","Хочу поправить отзыв Александра. Да, прекрасный прибор для измерения площадей, сам пользуюсь, но с одной поправочкой, прибор должен быть для этого подготовлен и прошит специальной программой"
